{
  "jsonrpc": "2.0",
  "method": "env.hitl_request",
  "params": {
    "hitlId": "el-01",
    "message": "Choose a deployment target",
    "kind": "question",
    "executionId": "123e4567-e89b-12d3-a456-426614174000",
    "form": {
      "type": "object",
      "properties": {
        "target": { "type": "string" }
      },
      "required": ["target"]
    }
  },
  "id": 43
}
