{
  "jsonrpc": "2.0",
  "method": "chat.send",
  "params": {
    "chatId": "123e4567-e89b-12d3-a456-426614174000",
    "message": "Build a new features dashboard",
    "teamId": "123e4567-e89b-12d3-a456-426614174001",
    "providerId": "123e4567-e89b-12d3-a456-426614174002",
    "modelName": "claude-sonnet-4"
  },
  "id": 1
}
